{
  "schema_version": "paper2-claim-ir-v1",
  "claim_id": "PVS-BLF-01.C1",
  "provenance": {
    "paper_id": "DOI:10.1523/JNEUROSCI.0822-10.2010",
    "source_language": "en",
    "source_spans": [
      {
        "span_id": "s1",
        "locator": "Journal of Neuroscience 30(37), pp.12366-12378 abstract: unexpected outcomes should have greater influence when they signal an environmental change than when they arise from persistent stochasticity."
      },
      {
        "span_id": "s2",
        "locator": "Same paper results: update gain increases on inferred change-point trials and depends on error magnitude relative to expected environmental noise."
      },
      {
        "span_id": "s3",
        "locator": "Same paper: after a change point, update gain decays as evidence accumulates and confidence about the current generating state increases."
      }
    ],
    "authors": [
      "Matthew R. Nassar",
      "Robert C. Wilson",
      "Benjamin Heasly",
      "Joshua I. Gold"
    ],
    "institutions": [],
    "venue": "Journal of Neuroscience",
    "citation_count": null,
    "construct_labels": [
      "belief updating",
      "Bayesian delta-rule",
      "learning rate"
    ]
  },
  "extraction": {
    "extractor": "ChatGPT",
    "extractor_version": "GPT-5.6 Sol",
    "procedure_version": "jgps-pvs16-source-grounded-candidate-v1:#365",
    "extracted_at": "2026-09-30",
    "manual_review_status": "unreviewed"
  },
  "claim_core": {
    "claim_type": "relation",
    "modality": "probabilistic",
    "scope": {
      "conditions": [
        "sequential predictions in an environment with stochastic observations and occasional changes in the generating state"
      ],
      "population": [
        "human participants"
      ],
      "substrate": [],
      "task": [
        "predict the next value from a sequence of noisy outcomes"
      ],
      "temporal_scope": [
        "trial-by-trial updating across and after environmental change points"
      ]
    },
    "nodes": [
      {
        "id": "outcome_history",
        "role": "available_information",
        "description": "sequence of recently observed outcomes",
        "source_span_ids": [
          "s1",
          "s2",
          "s3"
        ],
        "grounding": "normalized"
      },
      {
        "id": "relative_surprise",
        "role": "state_or_structure",
        "description": "magnitude of a new prediction error relative to expected environmental noise",
        "source_span_ids": [
          "s1",
          "s2"
        ],
        "grounding": "normalized"
      },
      {
        "id": "change_probability",
        "role": "state_or_structure",
        "description": "inferred probability that the generating state has changed",
        "source_span_ids": [
          "s1",
          "s2",
          "s3"
        ],
        "grounding": "normalized"
      },
      {
        "id": "update_gain",
        "role": "state_or_structure",
        "description": "influence assigned to the newest outcome when revising the current estimate",
        "source_span_ids": [
          "s1",
          "s2",
          "s3"
        ],
        "grounding": "normalized"
      },
      {
        "id": "next_prediction",
        "role": "response_or_outcome",
        "description": "prediction produced for the next observation",
        "source_span_ids": [
          "s1"
        ],
        "grounding": "normalized"
      }
    ],
    "relations": [
      {
        "id": "r1",
        "kind": "depends_on",
        "arguments": [
          "change_probability",
          "relative_surprise",
          "outcome_history"
        ],
        "description": "the inferred probability of an environmental change depends on how surprising the new outcome is relative to recent context",
        "source_span_ids": [
          "s1",
          "s2"
        ],
        "grounding": "normalized"
      },
      {
        "id": "r2",
        "kind": "depends_on",
        "arguments": [
          "update_gain",
          "change_probability"
        ],
        "description": "the influence of the newest outcome increases when a change in the generating state is more probable",
        "source_span_ids": [
          "s1",
          "s2"
        ],
        "grounding": "normalized"
      },
      {
        "id": "r3",
        "kind": "changes",
        "arguments": [
          "outcome_history",
          "update_gain"
        ],
        "description": "the update gain decreases over subsequent trials as evidence about the new state accumulates",
        "source_span_ids": [
          "s3"
        ],
        "grounding": "normalized"
      },
      {
        "id": "r4",
        "kind": "depends_on",
        "arguments": [
          "next_prediction",
          "outcome_history",
          "update_gain"
        ],
        "description": "the next prediction depends on past outcomes weighted by the current update gain",
        "source_span_ids": [
          "s1",
          "s2"
        ],
        "grounding": "normalized"
      }
    ]
  }
}
