{
  "schema_version": "paper2-claim-ir-v1",
  "claim_id": "LRN02.C1",
  "provenance": {
    "paper_id": "DOI:10.1126/science.275.5306.1593",
    "source_language": "en",
    "source_spans": [
      {
        "span_id": "s1",
        "locator": "Science 275, published p.1593, opening/abstract: learning related to changes in expectations about future salient outcomes"
      },
      {
        "span_id": "s2",
        "locator": "Science 275, published p.1594, 'Information Encoded in Dopaminergic Activity': phasic output shifts from outcome to predictive cue across training and is depressed when expected outcome is omitted"
      },
      {
        "span_id": "s3",
        "locator": "Science 275, published pp.1594-1595, interpretation/model: output codes deviation between actual outcome and prediction; signed better/equal/worse-than-expected pattern"
      }
    ],
    "authors": [
      "Wolfram Schultz",
      "Peter Dayan",
      "P. Read Montague"
    ],
    "institutions": [],
    "venue": "Science",
    "citation_count": null,
    "construct_labels": [
      "reward prediction error",
      "dopamine neurons",
      "temporal-difference learning",
      "reward prediction"
    ]
  },
  "extraction": {
    "extractor": "ChatGPT",
    "extractor_version": "GPT-5.6 Sol",
    "procedure_version": "chatgpt-primary-decomposition-v1:5857260823",
    "extracted_at": "2026-09-28",
    "manual_review_status": "unreviewed"
  },
  "claim_core": {
    "claim_type": "mapping",
    "modality": "descriptive",
    "scope": {
      "conditions": [
        "conditioning situations with predictive sensory cues and appetitive outcomes"
      ],
      "population": [
        "nonhuman primates"
      ],
      "substrate": [
        "midbrain neuromodulatory cell population"
      ],
      "task": [
        "cue-outcome conditioning tasks"
      ],
      "temporal_scope": [
        "across training and at the expected time of outcome delivery"
      ]
    },
    "nodes": [
      {
        "id": "predictive_cue",
        "role": "available_information",
        "description": "sensory cue that comes to forecast a later appetitive outcome",
        "source_span_ids": [
          "s1",
          "s2"
        ],
        "grounding": "normalized"
      },
      {
        "id": "expected_outcome",
        "role": "state_or_structure",
        "description": "learned expectation about the time and magnitude of a future appetitive outcome",
        "source_span_ids": [
          "s1",
          "s2",
          "s3"
        ],
        "grounding": "normalized"
      },
      {
        "id": "actual_outcome",
        "role": "condition",
        "description": "appetitive outcome actually delivered or omitted",
        "source_span_ids": [
          "s2",
          "s3"
        ],
        "grounding": "normalized"
      },
      {
        "id": "phasic_output",
        "role": "response_or_outcome",
        "description": "transient change in firing of the source-defined midbrain cell population",
        "source_span_ids": [
          "s2",
          "s3"
        ],
        "grounding": "normalized"
      },
      {
        "id": "signed_discrepancy_rule",
        "role": "criterion",
        "description": "comparison of actual outcome with the learned expectation, with positive, neutral, and negative cases",
        "source_span_ids": [
          "s3"
        ],
        "grounding": "normalized"
      },
      {
        "id": "cue_outcome_probe",
        "role": "probe",
        "description": "manipulation of whether an appetitive outcome is unpredicted, predicted, or omitted at its expected time",
        "source_span_ids": [
          "s2",
          "s3"
        ],
        "grounding": "normalized"
      }
    ],
    "relations": [
      {
        "id": "r1",
        "kind": "depends_on",
        "arguments": [
          "phasic_output",
          "actual_outcome",
          "expected_outcome"
        ],
        "description": "transient output depends on the discrepancy between the actual and expected appetitive outcome",
        "source_span_ids": [
          "s2",
          "s3"
        ],
        "grounding": "normalized"
      },
      {
        "id": "r2",
        "kind": "maps_to",
        "arguments": [
          "phasic_output",
          "signed_discrepancy_rule"
        ],
        "description": "increased, unchanged, and decreased transient output map onto better-than, as-expected, and worse-than-expected cases",
        "source_span_ids": [
          "s3"
        ],
        "grounding": "normalized"
      },
      {
        "id": "r3",
        "kind": "changes",
        "arguments": [
          "predictive_cue",
          "phasic_output"
        ],
        "description": "with repeated cue-outcome pairing the transient response shifts from outcome delivery to onset of the predictive cue",
        "source_span_ids": [
          "s2"
        ],
        "grounding": "normalized"
      },
      {
        "id": "r4",
        "kind": "maps_to",
        "arguments": [
          "cue_outcome_probe",
          "phasic_output"
        ],
        "description": "the cue/outcome manipulation exposes the signed transient response pattern",
        "source_span_ids": [
          "s2",
          "s3"
        ],
        "grounding": "normalized"
      },
      {
        "id": "r5",
        "kind": "precedes",
        "arguments": [
          "predictive_cue",
          "expected_outcome",
          "actual_outcome"
        ],
        "description": "the learned cue precedes the time at which the appetitive outcome is expected and then delivered or omitted",
        "source_span_ids": [
          "s2"
        ],
        "grounding": "normalized"
      }
    ]
  }
}
